### ISSUE TITLE
running pimd on the same machine

### ISSUE THREAD

**Issue by teamblubee** [troglobit/pimd#206]
I am using debian with ip, route, pimd. 
Running pimd on the same machine that needs to create a gre tunnel.

I have a network connection where I need to bring up a GRE tunnel but I am getting routing information broadcast.

Scanning with tcdump I am getting this loop
```
21:24:22.587555 IP 192.168.254.1 > 192.168.0.60: GREv0, length 62: IP 192.168.4.233 > 224.0.0.13: PIMv2, Hello, length 38    
21:24:45.670504 IP 192.168.254.1 > 192.168.0.60: GREv0, length 36: IP 192.168.4.233 > 224.0.0.1: igmp query v2    
21:24:51.787331 IP 192.168.254.1 > 192.168.0.60: GREv0, length 62: IP 192.168.4.233 > 224.0.0.13: PIMv2, Hello, length 38    
21:25:20.887682 IP 192.168.254.1 > 192.168.0.60: GREv0, length 62: IP 192.168.4.233 > 224.0.0.13: PIMv2, Hello, length 38    
21:25:45.670673 IP 192.168.254.1 > 192.168.0.60: GREv0, length 36: IP 192.168.4.233 > 224.0.0.1: igmp query v2    
21:25:50.487457 IP 192.168.254.1 > 192.168.0.60: GREv0, length 62: IP 192.168.4.233 > 224.0.0.13: PIMv2, Hello, length 38    
21:26:20.237066 IP 192.168.254.1 > 192.168.0.60: GREv0, length 62: IP 192.168.4.233 > 224.0.0.13: PIMv2, Hello, length 38    
21:26:45.670849 IP 192.168.254.1 > 192.168.0.60: GREv0, length 36: IP 192.168.4.233 > 224.0.0.1: igmp query v2    
21:26:49.937594 IP 192.168.254.1 > 192.168.0.60: GREv0, length 62: IP 192.168.4.233 > 224.0.0.13: PIMv2, Hello, length 38    
21:27:19.887558 IP 192.168.254.1 > 192.168.0.60: GREv0, length 62: IP 192.168.4.233 > 224.0.0.13: PIMv2, Hello, length 38    
21:27:45.670875 IP 192.168.254.1 > 192.168.0.60: GREv0, length 36: IP 192.168.4.233 > 224.0.0.1: igmp query v2    
21:27:49.587255 IP 192.168.254.1 > 192.168.0.60: GREv0, length 62: IP 192.168.4.233 > 224.0.0.13: PIMv2, Hello, length 38    
21:28:19.037075 IP 192.168.254.1 > 192.168.0.60: GREv0, length 62: IP 192.168.4.233 > 224.0.0.13: PIMv2, Hello, length 38    
21:28:45.671013 IP 192.168.254.1 > 192.168.0.60: GREv0, length 36: IP 192.168.4.233 > 224.0.0.1: igmp query v2    
21:28:48.336608 IP 192.168.254.1 > 192.168.0.60: GREv0, length 62: IP 192.168.4.233 > 224.0.0.13: PIMv2, Hello, length 38    
21:29:18.086936 IP 192.168.254.1 > 192.168.0.60: GREv0, length 62: IP 192.168.4.233 > 224.0.0.13: PIMv2, Hello, length 38    
21:29:45.671450 IP 192.168.254.1 > 192.168.0.60: GREv0, length 36: IP 192.168.4.233 > 224.0.0.1: igmp query v2    
21:29:47.837119 IP 192.168.254.1 > 192.168.0.60: GREv0, length 62: IP 192.168.4.233 > 224.0.0.13: PIMv2, Hello, length 38    
21:30:17.336967 IP 192.168.254.1 > 192.168.0.60: GREv0, length 62: IP 192.168.4.233 > 224.0.0.13: PIMv2, Hello, length 38    
21:30:45.671627 IP 192.168.254.1 > 192.168.0.60: GREv0, length 36: IP 192.168.4.233 > 224.0.0.1: igmp query v2    
21:30:46.986704 IP 192.168.254.1 > 192.168.0.60: GREv0, length 62: IP 192.168.4.233 > 224.0.0.13: PIMv2, Hello, length 38    
21:31:16.787066 IP 192.168.254.1 > 192.168.0.60: GREv0, length 62: IP 192.168.4.233 > 224.0.0.13: PIMv2, Hello, length 38 
```

```pimd -n``` is showing this output
```
pimd: 21:29:02.209 New RP candidate 192.168.47.65 for group 224.0.0.0/4, priority 20                                         
pimd: 21:29:16.640 For src 169.254.0.1, iif is 1, next hop router is 10.1.0.1: NOT A PIM ROUTER
pimd: 21:29:36.631 For src 169.254.0.1, iif is 1, next hop router is 10.1.0.1: NOT A PIM ROUTER
pimd: 21:29:57.272 For src 169.254.0.1, iif is 1, next hop router is 10.1.0.1: NOT A PIM ROUTER
pimd: 21:30:16.938 For src 169.254.0.1, iif is 1, next hop router is 10.1.0.1: NOT A PIM ROUTER
pimd: 21:30:36.558 For src 169.254.0.1, iif is 1, next hop router is 10.1.0.1: NOT A PIM ROUTER
pimd: 21:30:57.459 For src 169.254.0.1, iif is 1, next hop router is 10.1.0.1: NOT A PIM ROUTER
pimd: 21:31:17.377 For src 169.254.0.1, iif is 1, next hop router is 10.1.0.1: NOT A PIM ROUTER
pimd: 21:31:37.161 For src 169.254.0.1, iif is 1, next hop router is 10.1.0.1: NOT A PIM ROUTER
pimd: 21:31:57.270 For src 169.254.0.1, iif is 1, next hop router is 10.1.0.1: NOT A PIM ROUTER
pimd: 21:32:16.815 For src 169.254.0.1, iif is 1, next hop router is 10.1.0.1: NOT A PIM ROUTER
pimd: 21:32:37.413 For src 169.254.0.1, iif is 1, next hop router is 10.1.0.1: NOT A PIM ROUTER
pimd: 21:32:57.473 For src 169.254.0.1, iif is 1, next hop router is 10.1.0.1: NOT A PIM ROUTER
pimd: 21:33:17.372 For src 169.254.0.1, iif is 1, next hop router is 10.1.0.1: NOT A PIM ROUTER
pimd: 21:33:36.595 For src 169.254.0.1, iif is 1, next hop router is 10.1.0.1: NOT A PIM ROUTER
```
Will I be able to run pimd on the same virtual machine that I am currently trying to bring up the GRE tunnel?
If not, what are some suggestions to re-architect the program?
